{
    "tribeEnvironment": "AUTODELEN",
    "tribeSubmissionType": "AUTODELEN_AANMELDING",
    "pdf": "https://example.com/documenten/api/v1/enkelvoudiginformatieobjecten/03c047e1-0083-4d8b-8b31-714564b9fdb9",
    "reference": "OF-ANDERSZONDER01",
    "attachments": [],
    "autodelen": {
        "voornaam": "Thijs",
        "achternaam": "Mulder",
        "postcode": "6555 IJ",
        "emailadres": "thijs.mulder@example.com",
        "telefoonnummer": "",
        "situatie": "ikWilAutodelenMetMijnEigenAuto",
        "hoeGevonden": "anders",
        "toelichtingHoeGevonden": null,
        "contactMetAnderen": "nee"
    }
}
