{
    "tribeEnvironment": "AUTODELEN",
    "tribeSubmissionType": "AUTODELEN_AANMELDING",
    "pdf": "https://example.com/documenten/api/v1/enkelvoudiginformatieobjecten/03c047e1-0083-4d8b-8b31-714564b9fdb9",
    "reference": "OF-ANDERSMET01",
    "attachments": [],
    "autodelen": {
        "voornaam": "Iris",
        "achternaam": "Bakker",
        "postcode": "6544 GH",
        "emailadres": "iris.bakker@example.com",
        "telefoonnummer": "0645678901",
        "situatie": "metHulpVanEenAanbieder",
        "hoeGevonden": "anders",
        "toelichtingHoeGevonden": "Via een folder bij de bibliotheek",
        "contactMetAnderen": "ja"
    }
}
