{
    "tribeEnvironment": "AUTODELEN",
    "tribeSubmissionType": "AUTODELEN_AANMELDING",
    "pdf": "https://example.com/documenten/api/v1/enkelvoudiginformatieobjecten/03c047e1-0083-4d8b-8b31-714564b9fdb9",
    "reference": "OF-EMAIL01",
    "attachments": [],
    "autodelen": {
        "voornaam": "Sanne",
        "achternaam": "de Wit",
        "postcode": "6522 CD",
        "emailadres": "sanne.dewit@example.com",
        "telefoonnummer": "",
        "situatie": "benieuwd",
        "hoeGevonden": "viaSocialeMedia",
        "contactMetAnderen": "nee"
    }
}
